{
  "id": "evidence:scan-1",
  "schema_version": "1.0",
  "scope": "runtime",
  "kind": "scan_snapshot",
  "provenance_uri": "cea://runtime/scan/scan-1",
  "content_hash": "sha256:0123456789abcdef0123456789abcdef0123456789abcdef0123456789abcdef",
  "target": {"process_identity_ref": "process:test", "epoch": 1},
  "produced_by_capability": "memory.scan",
  "observed_at": "2026-09-13T00:00:00Z"
}
